{
  "$schema": "http://json-schema.org/draft-07/schema#",
  "$id": "https://example.org/iso-package-manager/theme-pack.schema.json",
  "title": "ISO Package Manager theme pack",
  "description": "A shareable theme for ISO Package Manager. Point your editor at this file (\u0022$schema\u0022) to get completion and validation while you write a theme.",
  "type": "object",
  "required": ["schema_version", "id", "name", "base", "colors"],
  "additionalProperties": false,
  "properties": {
    "$schema": {
      "type": "string",
      "description": "Path or URL of this schema. Editors use it for autocompletion; the app ignores it."
    },
    "schema_version": {
      "const": 1,
      "description": "Format version. Must be 1."
    },
    "id": {
      "type": "string",
      "pattern": "^[a-z0-9][a-z0-9._-]{0,63}$",
      "description": "Unique machine name, lowercase, e.g. \u0022nord\u0022. Cannot collide with the built-in themes: default, modern-dark, windows-xp, graphical."
    },
    "name": {
      "type": "string",
      "minLength": 1,
      "maxLength": 48,
      "description": "The name users see in the Theme menu."
    },
    "author": {
      "type": "string",
      "maxLength": 120,
      "description": "Your name or handle. Shown in the validator and used to credit you when the theme is shared."
    },
    "version": {
      "type": "string",
      "pattern": "^\\d+(\\.\\d+){0,3}([-+][0-9A-Za-z.-]+)?$",
      "default": "1.0.0",
      "description": "Version of this theme pack. Bump it when you change colours."
    },
    "description": {
      "type": "string",
      "maxLength": 400
    },
    "license": {
      "type": "string",
      "maxLength": 80,
      "description": "How others may reuse your theme, e.g. \u0022MIT\u0022 or \u0022CC0-1.0\u0022."
    },
    "homepage": {
      "type": "string",
      "description": "Optional http(s) link to your theme's page or repository."
    },
    "screenshot": {
      "type": "string",
      "description": "Optional image filename sitting next to this pack (or inside the .zip bundle). Relative, no directories."
    },
    "min_app_version": {
      "type": "string",
      "description": "Optional: the oldest app version this pack targets, e.g. \u00220.9\u0022."
    },
    "base": {
      "enum": ["default", "modern-dark", "windows-xp", "graphical"],
      "description": "Which built-in theme this pack starts from. Anything you do not set is inherited from it."
    },
    "font_family": {
      "type": "string",
      "maxLength": 80,
      "description": "Font family for all UI text. Use a font the target platform has, e.g. \u0022Segoe UI\u0022 (Windows), \u0022Cantarell\u0022 (GNOME), \u0022DejaVu Sans\u0022 (common on Linux)."
    },
    "colors": {
      "type": "object",
      "description": "Colour values are #rrggbb, #rgb, or a Tk colour name such as \u0022whitesmoke\u0022.",
      "required": [
        "bg",
        "panel",
        "text",
        "muted",
        "accent",
        "accent_active",
        "danger",
        "danger_active",
        "border",
        "selection"
      ],
      "additionalProperties": false,
      "properties": {
        "bg": {
          "$ref": "#/definitions/color",
          "description": "Window background."
        },
        "panel": {
          "$ref": "#/definitions/color",
          "description": "Cards, side panels and list rows."
        },
        "text": {
          "$ref": "#/definitions/color",
          "description": "Primary text on bg and panel."
        },
        "muted": {
          "$ref": "#/definitions/color",
          "description": "Secondary/hint text."
        },
        "accent": {
          "$ref": "#/definitions/color",
          "description": "Primary buttons (Download, Scan, Save)."
        },
        "accent_active": {
          "$ref": "#/definitions/color",
          "description": "Primary button colour while hovered/pressed."
        },
        "danger": {
          "$ref": "#/definitions/color",
          "description": "Destructive buttons (Stop, Delete)."
        },
        "danger_active": {
          "$ref": "#/definitions/color",
          "description": "Destructive button colour while hovered/pressed."
        },
        "border": {
          "$ref": "#/definitions/color",
          "description": "Separators, frame edges, focus rings."
        },
        "selection": {
          "$ref": "#/definitions/color",
          "description": "Selected row background in lists/trees."
        },
        "tree_bg": {
          "$ref": "#/definitions/color",
          "description": "List/table background. Defaults to panel."
        },
        "tree_heading_bg": {
          "$ref": "#/definitions/color",
          "description": "Table header background. Defaults to bg."
        },
        "tree_heading_fg": {
          "$ref": "#/definitions/color",
          "description": "Table header text. Defaults to text."
        },
        "tab_bg": {
          "$ref": "#/definitions/color",
          "description": "Unselected tab background. Defaults to panel."
        },
        "tab_selected_bg": {
          "$ref": "#/definitions/color",
          "description": "Selected tab background. Defaults to bg."
        },
        "accent_text": {
          "$ref": "#/definitions/color",
          "description": "Text on accent-coloured buttons. Use a dark colour when your accent is light. Defaults to #ffffff."
        },
        "selection_fg": {
          "$ref": "#/definitions/color",
          "description": "Text on a selected row. Defaults to #ffffff."
        }
      }
    },
    "style": {
      "type": "object",
      "additionalProperties": false,
      "description": "Optional rendering switches. Leave them out to inherit from the base theme.",
      "properties": {
        "ttk_theme": {
          "enum": ["auto", "clam", "alt", "default", "classic", "vista", "xpnative", "winnative", "aqua"],
          "default": "auto",
          "description": "Underlying ttk engine theme. \u0022clam\u0022 is the most predictable across platforms."
        },
        "button_relief": {
          "enum": ["flat", "raised", "sunken", "groove", "ridge", "solid"],
          "description": "\u0022raised\u0022 gives chunky 3D buttons, \u0022flat\u0022 gives modern buttons."
        },
        "tab_relief": {
          "enum": ["flat", "raised", "sunken", "groove", "ridge", "solid"]
        },
        "tree_heading_relief": {
          "enum": ["flat", "raised", "sunken", "groove", "ridge", "solid"]
        },
        "disabled_bg": {
          "$ref": "#/definitions/colorOrKey",
          "description": "Background of a disabled button. May name a palette key, e.g. \u0022panel\u0022."
        },
        "disabled_fg": {
          "$ref": "#/definitions/colorOrKey"
        },
        "pressed_bg": {
          "$ref": "#/definitions/colorOrKey",
          "description": "Background while a button is pressed. Null means \u0022use accent_active\u0022."
        },
        "focus_border": {
          "$ref": "#/definitions/colorOrKey",
          "description": "Colour of the keyboard focus ring. May name a palette key such as \u0022accent\u0022."
        },
        "use_icons": {
          "type": "boolean",
          "default": false,
          "description": "Draw the built-in toolbar icons (the \u0022Graphical\u0022 look)."
        }
      }
    }
  },
  "definitions": {
    "color": {
      "type": "string",
      "anyOf": [
        {
          "pattern": "^#([0-9a-fA-F]{3}|[0-9a-fA-F]{6})$"
        },
        {
          "pattern": "^[a-zA-Z][a-zA-Z0-9 ]{0,31}$"
        }
      ]
    },
    "colorOrKey": {
      "anyOf": [
        {
          "$ref": "#/definitions/color"
        },
        {
          "type": "null"
        },
        {
          "enum": [
            "bg",
            "panel",
            "text",
            "muted",
            "accent",
            "accent_active",
            "danger",
            "danger_active",
            "border",
            "selection",
            "tree_bg",
            "tree_heading_bg",
            "tree_heading_fg",
            "tab_bg",
            "tab_selected_bg",
            "accent_text",
            "selection_fg"
          ]
        }
      ]
    }
  }
}
