{
  "$schema": "../theme-pack.schema.json",
  "schema_version": 1,
  "id": "solarized-light",
  "name": "Solarized Light",
  "author": "Ethan Schoonover (palette) / community pack",
  "version": "1.0.0",
  "description": "Low-contrast, easy-on-the-eyes light theme with a measured accent.",
  "license": "MIT",
  "homepage": "https://ethanschoonover.com/solarized/",
  "base": "default",
  "font_family": "Segoe UI",
  "colors": {
    "bg": "#fdf6e3",
    "panel": "#eee8d5",
    "text": "#073642",
    "muted": "#586e75",
    "accent": "#268bd2",
    "accent_active": "#1f6fa8",
    "danger": "#dc322f",
    "danger_active": "#b32624",
    "border": "#d8cfb0",
    "selection": "#268bd2",
    "tree_bg": "#eee8d5",
    "tree_heading_bg": "#e4ddc8",
    "tree_heading_fg": "#073642",
    "tab_bg": "#eee8d5",
    "tab_selected_bg": "#fdf6e3",
    "accent_text": "#fdf6e3",
    "selection_fg": "#fdf6e3"
  },
  "style": {
    "ttk_theme": "clam",
    "button_relief": "flat",
    "disabled_bg": "#e4ddc8",
    "disabled_fg": "#93a1a1"
  }
}
