{
  "$schema": "../theme-pack.schema.json",
  "schema_version": 1,
  "id": "catppuccin-mocha",
  "name": "Catppuccin Mocha",
  "author": "Catppuccin (palette) / community pack",
  "version": "1.0.0",
  "description": "Soothing pastel dark theme - soft lavender accents on a warm charcoal base.",
  "license": "MIT",
  "homepage": "https://catppuccin.com/",
  "base": "modern-dark",
  "font_family": "Segoe UI",
  "colors": {
    "bg": "#1e1e2e",
    "panel": "#313244",
    "text": "#cdd6f4",
    "muted": "#a6adc8",
    "accent": "#89b4fa",
    "accent_active": "#74a8f7",
    "danger": "#f38ba8",
    "danger_active": "#d97a94",
    "border": "#45475a",
    "selection": "#585b70",
    "tree_bg": "#313244",
    "tree_heading_bg": "#45475a",
    "tree_heading_fg": "#cdd6f4",
    "tab_bg": "#313244",
    "tab_selected_bg": "#1e1e2e",
    "accent_text": "#1e1e2e",
    "selection_fg": "#cdd6f4"
  },
  "style": {
    "ttk_theme": "clam",
    "button_relief": "flat",
    "disabled_bg": "#45475a",
    "disabled_fg": "#7f849c",
    "use_icons": false
  }
}
