{
  "$schema": "../theme-pack.schema.json",
  "schema_version": 1,
  "id": "dracula",
  "name": "Dracula",
  "author": "Dracula Theme (palette) / community pack",
  "version": "1.0.0",
  "description": "The classic high-contrast purple-on-charcoal dark theme.",
  "license": "MIT",
  "homepage": "https://draculatheme.com/",
  "base": "modern-dark",
  "font_family": "Segoe UI",
  "colors": {
    "bg": "#282a36",
    "panel": "#343746",
    "text": "#f8f8f2",
    "muted": "#b8bccb",
    "accent": "#bd93f9",
    "accent_active": "#a679e8",
    "danger": "#ff5555",
    "danger_active": "#e04444",
    "border": "#44475a",
    "selection": "#6272a4",
    "tree_bg": "#343746",
    "tree_heading_bg": "#44475a",
    "tree_heading_fg": "#f8f8f2",
    "tab_bg": "#343746",
    "tab_selected_bg": "#282a36",
    "accent_text": "#282a36",
    "selection_fg": "#f8f8f2"
  },
  "style": {
    "ttk_theme": "clam",
    "button_relief": "flat",
    "disabled_bg": "#44475a",
    "disabled_fg": "#8b90a8"
  }
}
